videoTitle,videoCategoryId,videoViews,videoLikes,videoDislikes,videoCommentCount,channelViewCount,channelSubsCount,channelVideoCount,dayDifference,publishedZTimeFloat,publishedDayOfWeek,ageOfChannelDays,videoDurationSeconds,numberOfVideoTags
The Grave of the SECRET PORPOISE *ssshh*,27,261032,25541,169,2266,133970806,1120000,233,5,14.01694444,7,3190,528,14
Kenia Os - Dinero (Official Video),10,4170341,419703,40231,69961,303840061,3050000,17,6,22.00305556,6,697,162,28
Going into Labor During the Pandemic - itsjudyslife,22,611220,21578,330,2459,1004672982,1720000,3083,5,19.00305556,1,3761,906,21
Ryan Blaney LIVE in-car at Talladega Superspeedway | NASCAR Cup Series,17,137369,3038,157,143,239340487,521000,12444,3,2.186666667,3,3118,17721,0
Introducing Naturium: My New Skincare Brand!,26,349756,22032,5258,7404,140183297,1250000,320,4,1.001111111,2,2494,1319,7
"""Call it!"" - UFC fighter throws in the towel as trainer won't stop the fight | Corner Cam",17,1213171,16357,356,2647,1338081240,2810000,5857,5,17.00833333,1,2732,115,7
Testing Weird Products I Bought Online From Shein!,26,255030,12098,106,980,114177287,1280000,142,5,17.10277778,1,2223,1200,25
the truth about us ft. Nikita & Larray,22,3425009,254972,3224,21494,35581601,1570000,11,6,19.1525,7,241,660,6
LOST Children at Bondi Beach,24,5411041,118813,1827,12748,254857348,806000,465,6,22.00055556,7,4876,1004,22
"Mixer is Dead, Ninja and Shroud Free to Go Elsewhere",20,226718,7578,141,1344,37395166,175000,2349,4,19.00138889,2,788,183,25
Unboxing and Testing Two Surprise Mountain Bikes!,17,746934,34791,525,2176,19740774,442000,26,5,14.00416667,1,196,921,9
I Solved The Disappearance Of My Dad's Best Friend,22,1042393,71348,760,4349,385543786,3900000,179,5,15.00361111,1,774,1992,27
THANK YOU A MILLION,1,912689,104612,473,8412,125758721,1060000,87,5,17.00083333,1,1755,534,6
Addicted to PALETAS,23,643162,22541,834,2605,233961092,790000,227,5,23.00333333,1,3975,266,19
We Became Identical And Switched Places. No One Noticed,23,4569812,490915,3144,23276,1762420818,11100000,267,6,19.00305556,7,2300,1127,4
Apple WWDC 2020 Complete Recap,28,198309,5372,215,774,37997826,658000,147,4,20.4375,2,1714,2804,3
"Shootings over violent weekend leave more than 60 wounded, 9 dead including 3-year-old",25,953133,13992,614,13622,148335338,109000,7159,5,23.31194444,1,5210,158,8
Taylor Swift - Cornelia Street (Live From Paris),10,887604,110175,573,7434,18848587199,26700000,126,4,10.00583333,2,4063,302,8
I'M GETTING ENGAGED! PLANNING THE PERFECT PROPOSAL,22,676206,44858,560,4176,188949021,1940000,378,6,18.00111111,1,1869,454,12
The Headhunter (Clash of Clans Official),20,6470432,144616,3749,6204,2423573332,15600000,0,6,11.89861111,1,2704,65,28
"HIGHLIGHTS! | MAN CITY 5-0 BURNLEY | PHIL FODEN, RIYAD MAHREZ, DAVID SILVA | MAN CITY",17,1415969,24447,855,1667,652531282,2550000,5024,5,23.00111111,2,4008,121,31
Italian Beef Sandwich | Matty Matheson's Home Style Cookery Ep. 1,23,801450,25746,722,2396,18827885,628000,30,6,15.00277778,1,5214,601,16
iOS 14: iPhone FINALLY copies Android,28,153109,6414,341,1535,544607472,1570000,4451,5,18.89027778,2,4768,519,29
MANCHESTER UNITED vs SHEFFIELD UNITED With MARK GOLDBRIDGE LIVE,17,408359,8618,317,179,312649716,722000,4429,3,19.87861111,4,2152,10953,23
Solskjaer 3 Transfers From Title! Man Utd Transfer News,24,147317,5550,219,855,312649716,722000,4429,2,10.10916667,5,2152,1827,24
A Tour Of My Plants! (living and dead),22,299282,53391,94,6323,620344118,4100000,288,5,19.00277778,2,5254,624,30
Not Now Bernard | Cbeebies Bedtime Stories With A Roadman,22,182805,14314,96,672,5557803,93500,59,5,14.98166667,2,4914,354,23
PE With Joe | Monday 22nd June,17,366951,8884,263,479,191936271,2490000,0,5,8.851944444,2,3242,2413,0
London Apartment Hunting + who I'm Moving in With !,26,386568,22022,261,808,44553750,572000,218,6,15.86305556,1,2237,1412,33
WHAT i GOT for my 15th BIRTHDAY !!,22,259347,16751,279,1241,29123510,331000,81,6,18.005,1,728,779,11
SIDEMEN vs W2S FOOTBALL CHALLENGE,24,4935394,317695,2929,15837,1623348770,8500000,153,6,17.00416667,1,1840,1375,5
"Big Show confronts Randy Orton & Ric Flair: Raw, June 22, 2020",17,1703416,41711,1080,2715,44765712246,62200000,48296,4,3.925833333,3,4796,191,29
Korda Thinking Tackle OD 3 EP1: Danny Fairbrass & Darrell Peck | Carp Fishing 2020 (100 MINUTES),17,176845,2145,62,375,44822818,163000,932,6,16.75,1,3745,5988,25
"Rey Mysterio wants payback against Seth Rollins: Raw, June 22, 2020",17,2252482,52122,1608,2038,44765712246,62200000,48296,4,4.263055556,3,4796,184,29
WWDC 2020 Impressions: Widgets and The Great Transition!,28,4520359,206965,3949,22495,1947317079,11400000,1246,4,1.848055556,3,4481,932,8
"Dolph Ziggler challenges Drew McIntyre for Extreme Rules: Raw, June 22, 2020",17,956570,23548,761,2256,44765712246,62200000,48296,4,3.124166667,3,4796,185,25
Somebody That I Used To Know (Bardcore/Medieval Style Cover with Vocals),10,1177206,122832,398,6285,13454213,503000,5,6,18.35111111,1,5102,269,11
Every Postmates Ever,23,637845,36873,643,2574,9496367028,25100000,1131,5,16.00638889,2,5334,754,10
FLAWLESS Female Singers Audition For The X Factor UK | X Factor Global,24,141846,941,79,69,1377680733,3810000,914,5,15.50166667,2,2704,1271,27
Brighton 2-1 Arsenal | Arsenal Are Spineless! (DT Passionate Rant),17,885226,18882,1044,4812,836359556,1160000,12513,7,16.84972222,7,2805,781,36
The Critic | Rudy Mancuso,23,267861,25040,289,1087,1288438701,7330000,131,4,14.98027778,3,3193,257,28
4 Levels of Dumplings: Amateur to Food Scientist | Epicurious,24,957772,22451,431,3043,740808106,2840000,1240,4,16.00083333,3,4651,1250,26
Cash vs Brawadis 1v1 Rivalry Basketball Game!,24,1607093,95030,3010,16104,754500137,3610000,2129,6,17.00972222,1,2562,2592,15
G-Eazy - Nostalgia Cycle (Visualizer),10,596501,37932,1321,2196,3433764825,3800000,149,5,16.00527778,2,2255,165,34
Recreating Taco Bell's Discontinued Volcano Taco,24,377016,15830,135,1319,59484803,1340000,76,4,10.0075,3,2347,819,22
The US electrical system is not 120V,28,566127,41976,879,12032,66780894,750000,112,5,13.41805556,2,2057,1466,0
The full story of our accident.,22,750180,55958,272,3543,29519523,411000,32,6,18.18416667,1,1251,1989,5
telling my boyfriend i might be pregnant,24,1022050,61653,1746,8942,282853645,1900000,323,6,20.18027778,1,1469,778,14
Surprising Logan Paul With My New Car,22,259712,16299,301,659,688637,20600,5,5,16.38583333,2,143,613,21
"Today, we lost someone special",22,1050204,147619,561,28534,452294096,1960000,378,4,17.90638889,4,1976,134,0
Karabasan - Les histoires bizarres du professeur Zarbi,23,125890,8820,100,737,230726324,677000,327,4,4.003888889,4,3825,631,16
Visa Zero Liability,24,3343022,33,36,29,5909924,3630,12,19,19.82333333,3,3614,16,0
First Overall Pick,17,103034,11936,88,2633,34409814,125000,1780,4,3.864722222,4,4871,689,6
COPYCAT 2 - PAROLE DE CHAT,15,385364,35755,479,1621,378379699,1430000,134,4,10.4525,4,3436,164,0
GLK - Sinaloa feat. Soolking & Koba LaD (Clip Officiel),10,2424971,127784,4029,4817,113856319,470000,64,4,14.00138889,4,3801,237,11
Neil deGrasse Tyson Explains Nothing,28,402657,19726,420,3015,67311490,1190000,480,4,0.002222222,4,3476,825,25
Are Dean Unglert and Caelynn Miller-Keyes Married? - The Bachelor: The Greatest Seasons - Ever!,24,271339,2358,52,236,79336781,84400,702,5,6.003888889,3,1122,128,8
"GETTING MY LIFE TOGETHER *glow up, kinda*",24,3195510,222581,2958,12178,1110553088,9090000,0,7,19.13083333,1,1476,1033,6
Alicia Keys: NPR Music Tiny Desk Concert,10,1658528,80945,772,4064,1071509628,4150000,1796,6,9.005277778,2,4560,1667,9
HIGHLIGHTS | SPURS 2-0 WEST HAM,17,623794,10439,241,717,243550188,1160000,1779,5,23.25,3,3194,135,20
Bologna 0-2 Juventus | Juve Return to Serie A With a Win and 4 Points Clear of Lazio! | Serie A TIM,17,2731393,42812,1188,2232,1387514725,4600000,18908,6,22.51,2,2798,254,40
First Date Does My Makeup,24,5711413,258117,44797,50651,2354928335,18000000,378,7,18.00916667,1,5248,1524,17
CATHERINE'S IN LABOR!!!,22,9535890,519378,13704,51680,3824622121,18800000,540,6,0.305555556,2,1631,1116,13
Lindsey Stirling - Between Twilight,10,718833,69020,424,3052,2939567093,12500000,140,5,16.00277778,3,4788,277,8
Little Black Dresses for Every Occasion,26,165854,5855,82,510,74993460,1060000,119,5,17.00083333,3,804,1062,31
iOS 14 Beta 1 Review!,28,312152,6416,192,1351,213512881,583000,1762,6,22.82111111,2,3386,778,30
SMITE - Avatar Battle Pass - Available July 2020!,20,1023845,32517,830,4087,267102045,1080000,2168,6,15.19777778,2,3433,50,27
24 Hours NO PHONE Challenge!!  *locking our phones away,24,868778,49461,1179,9718,1171675033,8250000,332,6,1.060833333,2,4454,1039,15
#Hamilfilm Official Trailer,24,988934,54148,980,5729,81413193,491000,0,6,2.360277778,2,1866,60,0
Maes - Dybala ft. Jul,10,2530995,111852,2372,3745,320341172,42700,10,5,14.00222222,3,737,211,17
Why Americans Eat Dessert for Breakfast,27,696622,46662,2478,10560,12208590,340000,33,6,13.90555556,2,3308,793,16
Des larmes de rires avec Jonathan Cohen (le secret de Carlito),24,3563588,296706,9132,11847,1119213100,5580000,239,7,8.014722222,1,2748,1956,25
GOLDBRIDGE! MAGUIRE TIME! NORWICH 1-2 MANCHESTER UNITED Match Reaction,17,164186,6050,246,783,313635104,724000,4441,1,20.35111111,7,2153,1940,23
Chelsea beat Man City to crown Liverpool PL Champions | Chelsea 2-1 Man City | EPL Highlights,17,1178209,20425,705,3812,970649501,2140000,3241,3,21.53916667,5,1819,186,24
Liverpool squad crash Virgil van Dijk interview after being crowned Premier League champions!,17,1279278,39172,908,2093,1340455089,2810000,5872,3,22.4175,5,2734,302,14
So Far (Official Video) | Karan Aujla |  J Statik | Planet Recordz | Latest Punjabi Songs 2020,10,5151183,237265,19750,22153,211377599,869000,493,3,4.506111111,5,4952,196,24
GOLDBRIDGE! MARTIAL HAT-TRICK AT LAST!!!  Manchester United 3-0 Sheffield United Match Reaction,17,251783,16211,294,799,313635104,724000,4441,4,20.03777778,4,2153,1792,23
Engagement Party | OZZY RAJA,23,540283,19659,663,1082,276579310,766000,201,3,6.0025,5,5229,227,9
Meeting of the Doctors | Doctor Who | HBO Max,24,241492,11286,171,1877,32297830,111000,53,4,16.00916667,4,361,1216,27
Getting a lab puppy,2,296138,16690,391,1696,210916222,607000,420,3,1.455555556,5,2142,4456,0
YACHT TOUR SUNSEEKER 84 MANHATTAN! | VLOG 01 (PART 2) S.5,22,447478,15359,243,635,389102600,1470000,892,4,17.92305556,4,4664,637,0
"THREE DOCTORS! Jodie Whittaker, Matt Smith and David Tennant | HBO Max | Doctor Who",24,191332,9884,106,855,507066205,1440000,0,4,16.00277778,4,5309,91,24
The Yiannimize Courtesy Car Fleet Getting a Makeover!,2,108623,2469,89,506,240435763,1550000,0,4,18.00222222,4,2357,307,6
PE With Joe | Wednesday 24th June,17,299731,7752,220,324,192194606,2490000,436,4,8.568055556,4,3243,1983,0
HOW I LOST 30 POUNDS IN 3 MONTHS,23,193247,17793,109,1023,19666064,629000,28,3,2.233333333,5,967,1153,0
Drone Helicopter Hybrid,28,648030,40594,518,1998,43552662,407000,122,4,16,4,3182,541,0
"My FULL London house tour, before everything changes *3 Years strong!*",26,682128,34387,348,2197,329755775,2910000,766,5,18.50277778,3,4145,1247,5
DT DAILY | LUIZ SIGNS A NEW CONTRACT AND IT'S NOT EVEN APRIL 1ST,17,94346,2994,118,619,47419271,235000,748,4,6.001111111,4,2732,804,25
We Shouldn't Lose Again! | Man United 3-0 Sheff Utd | United Review,17,86132,5436,67,431,29067919,143000,972,4,20.25777778,4,5093,1869,28
"KSI Reacts To YouTube Rappers (TMG, Dax, FaZe Jarvis) | The Cosign",10,675381,51003,905,3866,2025154755,8490000,2311,5,19.84722222,3,3175,580,34
Richard Hammond reveals scenes that never made it onto Top Gear,2,710607,28670,296,1408,177388709,1390000,370,4,18.15388889,4,1382,331,6
Highlights Real Madrid vs RCD Mallorca (2-0),17,1573430,13167,466,484,1405410439,5630000,34110,4,23.02138889,4,5099,91,43
Back To Work With THE SIDEMEN [W2S FOOTBALL CHALLENGE],22,515710,32656,158,1106,28489946,627000,85,5,12.56611111,3,2465,1198,0
We Broke Up.,22,227395,13726,929,3088,383290652,2510000,118,5,17,3,1709,389,0
KATIE PRICE: PRINCESS GET'S A PUPPY FT PETER ANDRE,24,330143,9426,396,829,5063423,123000,23,5,16.00027778,3,437,572,22
RENTING VS BUYING a home in 2020 the TRUE cost they don't want you to know  *You might be surprised*,22,106592,7145,74,849,6026716,244000,36,4,18.50166667,4,843,1075,7
Atalanta 3-2 Lazio | Atalanta Hit Back From 2 Goals Down To Beat Lazio 3-2! | Serie A TIM,17,1813535,27086,626,1447,1387514725,4600000,18908,4,22.50027778,4,2798,254,45
DAVID LUIZ SIGNS NEW ARSENAL CONTRACT,17,138718,6238,88,869,12941457,149000,450,5,23.83194444,3,2901,432,21
Inter 3-3 Sassuolo | Sassuolo Makes Incredible Comeback fIn The 89th Minute! | Serie A TIM,17,1484187,18948,603,937,1387514725,4600000,18908,4,20.50527778,4,2798,254,42
FUNNY MEMES: Don't Leave Me,24,4139359,295808,5890,14186,1812759794,9610000,976,5,18.0175,3,3441,622,3
Gypsy Bride Needs A 53ft Lorry To Carry Her Wedding Dress | Gypsy Brides US,24,422129,5484,279,632,2662903936,4210000,1922,5,11.00416667,3,2757,479,12
"Si Ferry Meets... Andy Halliday | Life at Rangers w/ Gerrard, Warburton & Pedro, Teammates & Stories",17,140199,2101,65,210,13090773,45200,308,6,15.96833333,2,1144,9265,35
Abra Cadabra - CADABRA FREESTYLE,10,1204381,56252,656,3255,1713628,0,0,7,15.00305556,1,1431,275,0
Highlights | Resumo: Benfica 3-4 Santa Clara (Liga 19/20 #28),22,283895,3886,273,955,67114660,179000,2413,5,21.3325,3,2046,278,28
Driving while Black pt.3,1,773969,85926,1696,5176,1180252634,7080000,361,5,12.00416667,3,5253,620,8
LEICESTER vs BRIGHTON With Mark Goldbridge LIVE,17,70054,1890,56,41,27294822,168000,716,5,20.02138889,3,1404,7245,12
Nothing But Thieves - Real Love Song (Lyric Video),10,217438,15407,96,1042,133526197,228000,107,5,18.50055556,3,2337,221,15
The most overlooked way to be more productive,1,517183,32243,277,1357,169264079,2770000,324,5,18.00083333,3,3261,653,13
Angry Man Humiliates Uber Driver. Driver Teaches Him a Lesson (2020),24,275971,35529,659,2228,325850838,5640000,270,5,16.08333333,3,5101,200,12
THE ARSENAL DEBATE: Gunners Finished As A Top Club?,17,358603,10238,254,1642,32064473,242000,130,6,16.05805556,2,956,1445,12
iOS 14 and all the WWDC updates!,28,403422,17523,525,1954,1185747715,6510000,0,5,8.090555556,3,5166,854,5
LIVERPOOL V CRYSTAL PALACE | WATCHALONG LIVE FANZONE COMMENTARY,17,87671,2190,59,64,148252864,419000,5653,3,1.463611111,5,3721,13027,20
"Son, are ya winning?",24,1512302,141649,627,4913,79756530,975000,39,5,1.1875,3,1475,26,0
First take: iOS 14 and all its new features,28,160395,3009,175,607,1197678548,2630000,19690,5,5.887777778,3,5168,491,12
Jennifer Aniston & Lisa Kudrow - Actors on Actors - Full Conversation,24,520442,15195,138,1026,320990809,663000,3528,6,20.00194444,2,5230,3556,12
Most UNEXPECTED LOW & DEEP VOICES in The Voice,24,505019,10002,186,300,1636880687,6330000,488,5,14.00194444,3,2235,602,21
Kendall & Kylie Jenner Growing Up Through KUWTK | Seasons 1-18 | Keeping Up With The Kardashians,24,1109873,31978,441,1026,732800949,807000,0,6,8.0025,2,2253,638,24
(Zone 2) Kwengface - Mad About Bars w/ Kenny Allstar [S5.E4] | @MixtapeMadness,10,296701,14438,150,1031,759680424,950000,5756,7,19.00472222,1,2570,268,15
24th Birthday DISASTER!,22,706678,45146,1756,5116,1524464217,6080000,1068,4,22.62888889,4,2334,627,11
I Accidentally Exposed Dixie & Griffin...,24,2080966,147772,2131,6807,71091108,1150000,31,3,17.00305556,5,1804,372,12
Junior H x Natanael Cano - Paso En Culiacan [Video Oficial],10,1281685,83896,4008,3504,1604576002,2740000,517,4,23.00305556,4,1916,293,22
When you just wanna vibe,23,694567,91186,289,7288,175434660,1450000,107,3,13.91416667,5,4923,260,12
Doing James Charles Makeup!,22,3819066,319516,4653,25995,507973324,5430000,0,5,20.44361111,3,3237,643,27
Cooking My Sisters Favorite Meal!,24,2204503,118930,2683,15038,512058217,4680000,105,5,17.90277778,3,3791,1973,9
BLACKPINK - 'How You Like That' M/V TEASER,10,24485779,2541904,53213,164131,9712145758,39300000,271,4,0.001111111,4,1460,20,23
"""Alexander Hamilton"" Clip | Hamilton | Disney+",1,598128,31942,545,2732,1421907569,3570000,1108,4,16.65472222,4,4240,50,0
THE PROPOSAL,22,771376,60551,1060,4239,189032825,1940000,378,4,16.01055556,4,1870,181,13
RPG Game Logic,23,1942370,258493,691,11915,486714069,3060000,168,4,0.219722222,4,3401,233,0
every episode of The Office,23,1006822,138327,1176,5091,53765032,780000,42,4,21.50027778,4,1605,169,25
The Last of Us Part II - Game Review,24,749682,37730,1538,8343,672542101,1720000,1698,3,4.011666667,5,4862,673,12
Morse Code - The Office US,24,754955,23285,151,671,1094275082,1960000,488,4,17.00111111,4,2267,126,21
how twitter verification works,23,884853,98850,436,2098,405345887,2050000,627,4,16.23527778,4,3578,56,14
Unpredictable Trick Shots | Dude Perfect,17,18311142,776512,13308,36743,11004483541,52000000,0,6,22.00305556,2,4121,291,44
A Boogie Wit Da Hoodie - Secrets,10,2428102,100820,996,3379,1526529185,3820000,150,5,22.7525,3,1633,178,27
Top 5 iOS 14 Features!,22,416606,19398,389,1755,1185747715,6510000,0,4,21.54916667,4,5166,331,1
Aladdin & Jasmine Break Up | Anwar Jibawi,23,678131,42579,1060,1817,1285282153,5880000,137,4,15.9775,4,1433,360,27
GENDER REVEAL GONE WRONG! SPEND THE DAY WITH ME,26,421264,16303,281,1186,617776427,6190000,573,4,17.03638889,4,3289,1250,11
TRAORE AND JIMENEZ COMBINE AGAIN! | Wolves 1-0 Bournemouth | Highlights,17,404923,8035,231,465,78249092,370000,1531,4,21.71055556,4,2942,125,21
SIGNAL DETECTED. TAG DESIGNATION: FOE,20,334146,25369,376,3779,71545717,443000,638,4,15.01027778,4,3976,75,12
[OFFICIAL VIDEO] Home - Pentatonix,10,935898,101812,590,4410,4504959789,18000000,220,4,16.00055556,4,3214,170,39
HAPPY FATHERS DAY,22,703652,39099,347,1339,5929835,238000,17,4,4.976111111,4,694,684,0
1v1 Against 7'0 Freshman Jahzare Jackson!,24,1411363,65231,870,6204,755241135,3610000,2130,5,19.97194444,3,2563,1412,23
What It's Like Dealing With Customer Service Online,23,333564,31941,154,1568,61202293,445000,0,4,19.17555556,4,4217,92,27
iann dior - Pretty Girls (Official Music Video),10,1889462,97435,2536,3523,93971941,570000,44,5,19.00277778,3,472,262,38
Nether Update: Official Trailer,20,4440413,311107,3122,33212,934651507,4880000,451,5,15,3,3477,84,6
Muppets Now | Official Trailer | Disney+,23,307370,13668,255,1825,402437201,843000,291,4,16.07083333,4,3873,61,13
kenzie feat. Sia - EXHALE (Quarantine Video),24,1688334,162798,2408,10051,312839274,3620000,144,4,16.00305556,4,1731,165,26
I HAD MULTIPLE PROCEDURES DONE. admitting to all my plastic surgery & showing you my experience.,22,694370,44729,1784,3575,415400248,3230000,356,4,1.002777778,4,1805,933,16
I spent a day with BLACK LIVES MATTER PROTESTERS,27,354047,52692,1239,6089,248303984,4440000,175,4,17.3025,4,4961,923,10
Can Twitch Chat fix the CATS movie? (using artificial intelligence),20,343223,26719,175,1545,84038426,901000,73,4,19.27805556,4,4487,563,16
Building a custom scissor lamp,28,659025,110733,949,6007,124879141,2220000,91,4,15.89611111,4,2662,683,6
BABY STEPS (Simon's Cat Origins Story: Part 2),1,518544,26484,236,886,1130388951,5320000,227,4,12.04361111,4,4610,183,38
365 Days is the worst movie I have ever seen...,24,1457702,113129,956,13530,278611950,2150000,207,5,18.005,3,1816,846,4
Lauv - Dishes [Official Video],10,813761,89358,692,3866,987312401,3340000,132,4,13.00777778,4,1937,159,8
iOS 14 Hands-On: Everything New!,28,5734422,233710,5005,22827,1949140386,11400000,1246,5,22.81194444,3,4482,692,16
Bring Me The Horizon - Parasite Eve (Trailer),10,217865,22979,112,1251,7400987,2800000,53,4,19.00527778,4,2834,21,31
NoCap - Suge Night [Official Video],10,1337917,53611,905,2278,194206641,385000,71,6,18.00222222,2,2819,205,22
Jorge Masvidal Responds To Dana White,17,380474,12242,471,2516,56190462,543000,109,4,22.10555556,4,317,95,27
Liverpool v. Crystal Palace | PREMIER LEAGUE HIGHLIGHTS | 6/24/2020 | NBC Sports,17,481531,5658,151,785,593317207,1230000,11866,4,22.44555556,4,3064,683,34
TAKING A PREGNANCY TEST ON CAMERA!!!,24,912292,46504,1416,9421,283339766,1900000,323,5,22.14055556,3,1470,886,20
Real Madrid 2 - 0 Mallorca - HIGHLIGHTS & GOALS - 6/24/20,17,421246,4503,194,713,60962204,302000,5708,4,22.22638889,4,2904,293,22
nba youngboy - death enclaimed,10,12414920,447733,12414,35503,5241975893,7810000,271,7,8.93,1,2002,270,23
Tee Grizzley - The Smartest Intro (feat. Mustard) [Official Video],10,1098958,58240,897,2223,540417166,1380000,154,6,16.00388889,2,1250,208,18
Cam Girl Obsession Turns Deadly [ Amato Case ] - Mystery & Makeup GRWM | Bailey Sarian,24,1260863,77819,847,6436,97990611,1370000,357,6,19.00222222,2,2713,2877,19
"Highlights: Liverpool 4-0 Crystal Palace | Salah, Mane & two screamers at Anfield",17,2137007,39829,1168,2023,811814023,4780000,1345,4,23.00333333,4,5362,105,7
Manchester United v. Sheffield United | PREMIER LEAGUE HIGHLIGHTS | 6/24/2020 | NBC Sports,17,381170,4743,116,564,593317207,1230000,11866,4,20.24888889,4,3064,694,32
I Have Bad News & Good News...,22,553794,31176,756,4102,2076129338,9380000,1965,5,21.25,3,3898,860,19
Keith Eats & Drinks Everything At Dunkin Donuts,23,3019628,115079,1733,12349,1300763537,7280000,252,6,15.00333333,2,767,2782,41
Top iOS 14 Features! What's New Review,28,1022922,36800,678,4798,2017428830,8190000,1708,4,1.504166667,4,4170,606,14
jxdn - Angels & Demons Acoustic (Official Video),10,1826580,283788,1743,17206,32023118,829000,5,5,15.98861111,3,425,174,22
twenty one pilots - How Those Codes Were Solved (A Recap for Locals),10,789608,119605,646,7258,2476075058,11000000,119,4,16.01527778,4,3949,415,23
"Removing The $100,000 Engine From My Wrecked Mclaren 675LT (Revealed MORE HIDDEN DAMAGE)",2,538159,24538,403,1498,208399023,1580000,412,4,17.11972222,4,5242,1213,55
Lil Baby - The Bigger Picture (Lyric Video),10,604659,21492,554,1513,1580122648,163000,72,6,19.00083333,2,781,255,13
OUR NEW HOUSE TOUR!!,23,1447781,112570,800,6749,249693072,2450000,195,6,22.55388889,2,2987,861,35
Hellas Verona 0-2 Napoli | Late Lozano Goal Seals Victory for Napoli! | Serie A TIM,17,807031,11482,220,651,1387514725,4600000,18908,5,20.88888889,3,2798,254,41
4 Plumbing Tricks I Haven't Seen Before!!!,22,327165,9372,248,1072,112801809,641000,816,5,23.44,3,4398,559,8
The Try Guys Ultimate Spicy Snacks Taste Test,23,1652533,77098,697,6684,1300763537,7280000,252,4,15.00361111,4,767,970,42
UNEDITED Makeup Tutorial,24,5118305,417105,4949,101138,2315041531,19700000,281,5,19.00638889,3,1671,3578,35
PREGNANT AFTER 15 YEARS OF INFERTILITY - Q&A,26,869787,96198,699,16125,111455595,1030000,687,6,23.00305556,2,2677,3546,14
Teens Find Body in Suitcase While Using Adventure App,25,2609461,90868,1193,9324,11618821611,7610000,20173,6,22.78638889,2,2819,125,15
SURPRISING ALEX FOR FATHERS DAY,26,832777,55742,678,3994,85549886,949000,121,6,21.08694444,2,3007,995,0
Who Has The Best French Fries Sauce? (Taste Test),24,1188088,40181,920,4338,6480287941,16400000,0,4,10.00222222,4,4302,898,13
Trying Tik Tok Life Hacks to see if they work,24,2899755,110479,1793,12895,6615607830,20600000,2362,5,18.50138889,3,2716,735,18
My Brother Almost FOUGHT This Dude! Indoor 5v5 Basketball!,24,1265945,55129,1632,4884,210725883,1960000,350,6,21.69277778,2,2329,1032,23
How To Install iOS 14 & iPadOS 14!,28,567242,11972,1420,1590,18600820,113000,424,6,19.11527778,2,1210,489,12
Deyjah Feels Uncomfortable Confronting Her Father | T.I. & Tiny: Friends & Family Hustle,24,767984,15817,221,1608,1200766145,2990000,2535,5,1.001944444,3,5201,139,32
TRICK SHOTS from Level 1 To Level 100,17,6607030,424262,10414,16288,482010166,2110000,109,5,1.133055556,3,2969,287,19
Miz Cracker - She's a Woman (Official Music Video) - YouTube,10,274838,28601,623,1826,17204338,228000,81,5,21.05333333,3,2022,158,12
Cooking BOMB AF FLAUTAS With My Boyfriend!! | Louie's Life,24,810374,57480,452,3873,207542330,2480000,218,6,22.5,2,2290,1138,43
Apple WWDC 2020 keynote in 18 minutes,28,1303542,27397,1806,5224,829935813,2960000,3899,6,19.48416667,2,5073,1129,48
actors who don't know how to smoke,23,321526,43423,253,1343,28580992,262000,81,5,16.27777778,3,1008,248,25
Fake Makita Impact Better? Let's find out!  Makita XWT11Z 18V LXT Lithium-Ion Brushless Cordless,26,2188566,54344,1515,7216,212044912,1240000,205,6,21,2,1253,739,27
"Bubba Wallace emotional as NASCAR's drivers, Richard Petty stand with him | NASCAR ON FOX",17,400683,8942,3054,5535,91173125,45800,1434,6,19.77666667,2,163,307,29
iOS 14 Beta 1 is Out! - What's New?,28,366015,9062,157,1453,244370642,701000,2465,5,2.201944444,3,4305,1612,31
goodbye Mia...,26,4061037,333400,5230,113684,1718267447,14100000,295,6,20.6825,2,3580,607,1
Stephen Sharer - In My Jeep (Official Music Video),10,1559838,43012,2878,10301,3648655338,8240000,665,5,14.25277778,3,5235,169,18
Filling The Hype House Pool With Plastic Balls!,24,1980016,140703,1599,6573,71091108,1150000,31,5,17.00277778,3,1804,403,12
State of the Role: Critical Role Return Updates,20,585423,56005,477,5994,156446767,941000,440,5,17.00388889,5,769,294,15
Xbox Series X - Optimized for Xbox Series X Trailer,20,731311,47474,2027,3733,851956041,3770000,7872,5,15.005,5,5355,42,23
WE MADE A TERRIBLE MISTAKE | Jeff's Barbershop,23,1586108,94170,722,4662,176154971,2420000,0,6,17.97,4,3217,602,13
Jon Stewart: The New Deal And GI Bill Explicitly Excluded Black People,24,1344414,25043,669,2953,6492618759,7640000,6829,5,7.583333333,5,1861,575,21
Angel Gomes Leaves! Solskjaer Press Conference Reaction! Brighton vs Manchester United Man Utd News,24,153740,5289,289,1106,314530317,726000,4446,1,10.3525,2,2155,2125,25
Incredible Ward-Prowse free-kick ends Watford's fightback | Watford 1-3 Southampton | EPL Highlights,17,414311,6892,82,1013,973723863,2150000,3253,2,17.78972222,1,1821,180,28
NORWICH vs MANCHESTER UNITED With MARK GOLDBRIDGE LIVE,17,421886,6495,334,86,314555662,726000,4446,3,19.48638889,7,2155,13313,24
Post-match interview | Ezgjan Alioski | Leeds United 3-0 Fulham,17,28664,824,7,120,12734685,80000,722,3,17.34694444,7,3130,203,5
